{
  "$schema": "https://json-schema.org/draft/2020-12/schema",
  "$id": "https://prometheus-ags.dev/schemas/kbd/handoff.schema.json",
  "title": "KBD stage handoff",
  "description": "Written to .kbd-orchestrator/phases/<node>/handoffs/<stage>.handoff.json when a lifecycle stage completes (or is explicitly skipped). The next stage's gate (shared/lib/stage-gate.sh kbd_stage_gate) requires the previous stage's handoff to exist. Stage order: assess → analyze → spec → plan → execute → reflect; analyze and spec are optional stages the gate walks back across when absent.",
  "type": "object",
  "required": ["stage", "completedAt", "skipped"],
  "properties": {
    "stage": {
      "enum": ["assess", "analyze", "spec", "plan", "execute", "reflect"],
      "description": "The stage this handoff closes."
    },
    "completedAt": {
      "type": "string",
      "format": "date-time",
      "description": "ISO-8601 UTC completion timestamp."
    },
    "outputs": {
      "type": "array",
      "items": { "type": "string" },
      "description": "Artifact paths this stage produced (phase-dir-relative or repo-relative)."
    },
    "nextStage": {
      "type": ["string", "null"],
      "description": "The following stage in canonical order; null after reflect."
    },
    "summaryForNext": {
      "type": "string",
      "description": "One-to-three sentences the next stage reads first: what was produced, what is open, what to do with it."
    },
    "skipped": {
      "type": "boolean",
      "description": "True when the stage was deliberately skipped; the gate passes but the skip is on record."
    },
    "skipReason": {
      "type": ["string", "null"],
      "description": "Required human reason when skipped is true."
    },
    "identity": {
      "type": "object",
      "description": "OPTIONAL for assess/analyze/spec handoffs, REQUIRED by the Plan→Execute boundary (enforced by shared/lib/stage-gate.sh). Binds the handoff to canonical identity and the adopted contract so stale or foreign handoffs are rejected instead of silently accepted.",
      "required": ["projectId", "runId", "phaseId", "planRevision", "contractDigest"],
      "properties": {
        "projectId": { "type": "string", "description": "Canonical project UUID from .prometheus/project.json." },
        "runId": { "type": "string", "description": "Canonical run id from prometheus kbd status." },
        "phaseId": { "type": "string", "description": "Canonical phase id; must equal the phase directory the handoff lives in." },
        "planRevision": { "type": "integer", "minimum": 0, "description": "Plan revision the handoff was produced against." },
        "contractDigest": { "type": "string", "pattern": "^[0-9a-f]{64}$", "description": "SHA-256 of the adopted contract under the contract's digestNormalization (identity.contractDigest and identity.planRevision excluded)." }
      },
      "additionalProperties": false
    }
  },
  "additionalProperties": false
}
